{"schema_version":1,"name":"all_hbf_direct_8","layout":"direct","stack_count":8,"hbm_count":0,"hbf_count":8,"hbf_profile":"hbf_assumed_8hi","hbm_profile":"micron_hbm4_36gb_12hi","external_fast_memory_profile":"gddr_logical_hbm_fixture","source_type":"ASSUMED","comparison_basis":"fixed_stack_count_only_interface_area_not_matched"}
