{"schema_version":1,"name":"mixed_direct_8","layout":"direct","stack_count":8,"hbm_count":2,"hbf_count":6,"hbf_profile":"hbf_assumed_16hi","hbm_profile":"micron_hbm4_36gb_12hi","external_fast_memory_profile":null,"source_type":"ASSUMED","comparison_basis":"fixed_stack_count_only_interface_area_not_matched"}
