{"schema_version":1,"name":"dash_4pairs_8stacks","layout":"dual","stack_count":8,"hbm_count":4,"hbf_count":4,"hbf_profile":"hbf_assumed_16hi","hbm_profile":"micron_hbm4_48gb_16hi","external_fast_memory_profile":null,"custom_base_die_relay":true,"requested_name":"DSAH","candidate_resolution":"DASH","name_status":"USER_CONFIRMED","source_type":"ASSUMED","comparison_basis":"fixed_stack_count_only_interface_area_not_matched","claim_status":"ARCHITECTURE_FIXTURE_NOT_VALIDATED_DASH_PERFORMANCE"}
